{"edges":[{"hypothesis_id":"bee3eed96d5da503adffbb7a1a45ff499461dc53603ab2cfac8cebc347282541","observation_a":"piece_00/view0","observation_b":"piece_01/view0","occurrence_ids":["078fd08e14d715ad31e592ef93ffe9d6717bd807eae611dca142e96340c0d5ec"],"piece_a":"piece_00","piece_b":"piece_01","pose":{"alignment":{"family":"similarity","geometry_score":0.9,"query_arc_fraction":[0.0,1.0],"target_arc_fraction":[0.0,1.0],"transform":[[1.0,0.0,27.0],[0.0,1.0,0.0],[0.0,0.0,1.0]]},"query":1,"span_a":null,"span_b":null,"target":7,"windows":[null,null]},"representative_occurrence":"078fd08e14d715ad31e592ef93ffe9d6717bd807eae611dca142e96340c0d5ec","score_method":"fixture","score_variant":"fixture_observable","transform_b_to_a":[[1.0,0.0,27.0],[0.0,1.0,0.0],[0.0,0.0,1.0]],"weight":0.9},{"hypothesis_id":"341e2fb7590b36b82101b1ac2606babb058cc3e300be3f7b207273bc9ea37f3f","observation_a":"piece_00/view0","observation_b":"piece_01/view0","occurrence_ids":["8a1822dd47b903eaeb1daa7305de4b5a53227975c85ea4a20f48721e87c5f397"],"piece_a":"piece_00","piece_b":"piece_01","pose":{"alignment":{"family":"similarity","geometry_score":0.9,"query_arc_fraction":[0.0,1.0],"target_arc_fraction":[0.0,1.0],"transform":[[1.0,0.0,107.0],[0.0,1.0,0.0],[0.0,0.0,1.0]]},"query":1,"span_a":null,"span_b":null,"target":7,"windows":[null,null]},"representative_occurrence":"8a1822dd47b903eaeb1daa7305de4b5a53227975c85ea4a20f48721e87c5f397","score_method":"fixture","score_variant":"fixture_observable","transform_b_to_a":[[1.0,0.0,107.0],[0.0,1.0,0.0],[0.0,0.0,1.0]],"weight":0.9},{"hypothesis_id":"494331bab9546cc378c90958541a3846cb07781eedd8137e4b4ea75a193adf1f","observation_a":"piece_00/view0","observation_b":"piece_02/view0","occurrence_ids":["6e3d55b34ce9c827401f6212dd48b669559a3ad6f3b8f0894cdde932af6f77f7"],"piece_a":"piece_00","piece_b":"piece_02","pose":{"alignment":{"family":"similarity","geometry_score":0.9,"query_arc_fraction":[0.0,1.0],"target_arc_fraction":[0.0,1.0],"transform":[[1.0,0.0,0.0],[0.0,1.0,27.0],[0.0,0.0,1.0]]},"query":2,"span_a":null,"span_b":null,"target":8,"windows":[null,null]},"representative_occurrence":"6e3d55b34ce9c827401f6212dd48b669559a3ad6f3b8f0894cdde932af6f77f7","score_method":"fixture","score_variant":"fixture_observable","transform_b_to_a":[[1.0,0.0,0.0],[0.0,1.0,27.0],[0.0,0.0,1.0]],"weight":0.9},{"hypothesis_id":"4fa76192705c1fb46ff394fd445d594e074a502e78526a5ff3d542f182e061a0","observation_a":"piece_00/view0","observation_b":"piece_02/view0","occurrence_ids":["515a07ed5232dd2431adf93860727ee061afd3c5202dcb4e02fb4a7bdcf4d875"],"piece_a":"piece_00","piece_b":"piece_02","pose":{"alignment":{"family":"similarity","geometry_score":0.9,"query_arc_fraction":[0.0,1.0],"target_arc_fraction":[0.0,1.0],"transform":[[1.0,0.0,80.0],[0.0,1.0,27.0],[0.0,0.0,1.0]]},"query":2,"span_a":null,"span_b":null,"target":8,"windows":[null,null]},"representative_occurrence":"515a07ed5232dd2431adf93860727ee061afd3c5202dcb4e02fb4a7bdcf4d875","score_method":"fixture","score_variant":"fixture_observable","transform_b_to_a":[[1.0,0.0,80.0],[0.0,1.0,27.0],[0.0,0.0,1.0]],"weight":0.9},{"hypothesis_id":"edeb3dfdba68e7f33eaba1d81b8b8930c32b221aa56ad1c85beddfde8eeabaa8","observation_a":"piece_01/view0","observation_b":"piece_03/view0","occurrence_ids":["abb8def626885b7c0578efe937666664c2b7e409bc38933f7b4b49ed01e100fa"],"piece_a":"piece_01","piece_b":"piece_03","pose":{"alignment":{"family":"similarity","geometry_score":0.9,"query_arc_fraction":[0.0,1.0],"target_arc_fraction":[0.0,1.0],"transform":[[1.0,0.0,0.0],[0.0,1.0,27.0],[0.0,0.0,1.0]]},"query":6,"span_a":null,"span_b":null,"target":12,"windows":[null,null]},"representative_occurrence":"abb8def626885b7c0578efe937666664c2b7e409bc38933f7b4b49ed01e100fa","score_method":"fixture","score_variant":"fixture_observable","transform_b_to_a":[[1.0,0.0,0.0],[0.0,1.0,27.0],[0.0,0.0,1.0]],"weight":0.9},{"hypothesis_id":"bc04c48f7a569a5e2a2b2654b3f6815ba02cef12387618cd47fe106564119100","observation_a":"piece_01/view0","observation_b":"piece_03/view0","occurrence_ids":["7d3abef4fa769f8cabe2caf90878358088b83a8aafeea12ec1523947d87c619a"],"piece_a":"piece_01","piece_b":"piece_03","pose":{"alignment":{"family":"similarity","geometry_score":0.9,"query_arc_fraction":[0.0,1.0],"target_arc_fraction":[0.0,1.0],"transform":[[1.0,0.0,80.0],[0.0,1.0,27.0],[0.0,0.0,1.0]]},"query":6,"span_a":null,"span_b":null,"target":12,"windows":[null,null]},"representative_occurrence":"7d3abef4fa769f8cabe2caf90878358088b83a8aafeea12ec1523947d87c619a","score_method":"fixture","score_variant":"fixture_observable","transform_b_to_a":[[1.0,0.0,80.0],[0.0,1.0,27.0],[0.0,0.0,1.0]],"weight":0.9},{"hypothesis_id":"2d111859a1b51ce11b64f3a41d3b0225a3d7e3b525a104ac2980b1d7e2259ea5","observation_a":"piece_02/view0","observation_b":"piece_03/view0","occurrence_ids":["357c07f4061849e230ff69c80496e8ef5afe431c49f62b2f2c4bc9d8bbb85f23"],"piece_a":"piece_02","piece_b":"piece_03","pose":{"alignment":{"family":"similarity","geometry_score":0.9,"query_arc_fraction":[0.0,1.0],"target_arc_fraction":[0.0,1.0],"transform":[[1.0,0.0,27.0],[0.0,1.0,0.0],[0.0,0.0,1.0]]},"query":9,"span_a":null,"span_b":null,"target":15,"windows":[null,null]},"representative_occurrence":"357c07f4061849e230ff69c80496e8ef5afe431c49f62b2f2c4bc9d8bbb85f23","score_method":"fixture","score_variant":"fixture_observable","transform_b_to_a":[[1.0,0.0,27.0],[0.0,1.0,0.0],[0.0,0.0,1.0]],"weight":0.9},{"hypothesis_id":"4fdf4c39d58f1f4f9bb7bb3be35ddd9bc70c6e3d5c00e2dd1c4354df226c7969","observation_a":"piece_02/view0","observation_b":"piece_03/view0","occurrence_ids":["b5e4536fdce8bef2c68ad0ea86d3ea249b21b2fa12fa1d45db1fb276bf68b802"],"piece_a":"piece_02","piece_b":"piece_03","pose":{"alignment":{"family":"similarity","geometry_score":0.9,"query_arc_fraction":[0.0,1.0],"target_arc_fraction":[0.0,1.0],"transform":[[1.0,0.0,107.0],[0.0,1.0,0.0],[0.0,0.0,1.0]]},"query":9,"span_a":null,"span_b":null,"target":15,"windows":[null,null]},"representative_occurrence":"b5e4536fdce8bef2c68ad0ea86d3ea249b21b2fa12fa1d45db1fb276bf68b802","score_method":"fixture","score_variant":"fixture_observable","transform_b_to_a":[[1.0,0.0,107.0],[0.0,1.0,0.0],[0.0,0.0,1.0]],"weight":0.9}],"maximum_per_physical_pair":24,"pairs":[{"available_geometries":2,"pieces":["piece_00","piece_01"],"resource_truncated":false,"working_geometries":2},{"available_geometries":2,"pieces":["piece_00","piece_02"],"resource_truncated":false,"working_geometries":2},{"available_geometries":2,"pieces":["piece_01","piece_03"],"resource_truncated":false,"working_geometries":2},{"available_geometries":2,"pieces":["piece_02","piece_03"],"resource_truncated":false,"working_geometries":2}],"schema_version":"stage3.working-pool.v1","scores_are_calibrated_probabilities":false,"selection":"explicit observable toy geometry"}
